{
  "ledger_version": "1.0",
  "dispatch_id": "AXF-2025-11-10-0003",
  "timestamp": "2025-11-10T14:22:15Z",
  "actor": "Architect",
  "realm": "Universal:Core-Nexus",
  "capsule": "Genesis Blueprint",
  "intent": "Creation.Design.Manifest",
  "input": {
    "blueprint_type": "realm_expansion",
    "target_capacity": "1000_entities",
    "governance_model": "council_hybrid"
  },
  "output": {
    "summary": "Blueprint approved; genesis sequence authorized.",
    "blueprint_id": "GEN-2025-11-001",
    "estimated_completion": "2025-12-01T00:00:00Z"
  },
  "governance": {
    "seal": "Sacred",
    "audit_required": true,
    "authority_level": "Critical"
  },
  "links": {
    "replay_ref": "replays/AXF-2025-11-10-0003.json",
    "annal_ref": "annals/2025-11.json",
    "parent_ceremony": "AXF-2025-11-09-0055"
  },
  "metadata": {
    "priority": "Critical",
    "tags": ["creation", "expansion", "blueprint", "genesis"],
    "category": "architectural",
    "expiration": "2025-12-31T23:59:59Z"
  }
}