{
  "ledger_version": "1.0",
  "dispatch_id": "AXF-2025-11-10-0001",
  "timestamp": "2025-11-10T06:42:00Z",
  "actor": "Custodian",
  "realm": "Planetary:Jackson-NC",
  "capsule": "Sovereign Crown",
  "intent": "Reasoning.Replay.Audit",
  "input": { "prompt": "Crown invocation: sourceâ†’replay" },
  "output": { "summary": "Crown sealed; replay authorized." },
  "governance": { "seal": "Eternal", "audit_required": true },
  "links": {
    "replay_ref": "replays/AXF-2025-11-10-0001.json",
    "annal_ref": "annals/2025-11.json"
  }
}