{
  "ledger_version": "1.0",
  "dispatch_id": "AXF-2025-11-10-0002",
  "timestamp": "2025-11-10T08:15:30Z",
  "actor": "Sentinel",
  "realm": "Stellar:Andromeda-Sector-7",
  "capsule": "Guardian Protocol",
  "intent": "Security.Monitoring.Alert",
  "input": {
    "threat_level": "Medium",
    "anomaly_detected": "unauthorized_access_attempt",
    "source_realm": "Unknown"
  },
  "output": {
    "summary": "Threat contained; monitoring protocols enhanced.",
    "action_taken": "realm_access_restrictions_updated",
    "status": "resolved"
  },
  "governance": {
    "seal": "Immutable",
    "audit_required": true,
    "authority_level": "High"
  },
  "links": {
    "replay_ref": "replays/AXF-2025-11-10-0002.json",
    "annal_ref": "annals/2025-11.json"
  },
  "metadata": {
    "priority": "High",
    "tags": ["security", "monitoring", "threat-response"],
    "category": "guardian"
  }
}